RatingID,CustomerID,ProductName,Rating,ReviewDate,ReviewText
R7779,C1281,Keyboard,4,2023-07-14,Also series occur personal wrong senior sometimes seat right anything too.
R7780,C1171,Earphones,2,2023-05-15,Drug child statement staff similar happen.
R7781,C1300,Washing Machine,1,2023-08-26,Land quickly think would get pick act happy.
R7782,C1126,Shoes,1,2025-10-01,Consider son several job hard husband question explain find right debate well.
R7783,C1876,Earphones,1,2023-06-23,Data indicate include democratic cell audience study.
R7784,C1598,Keyboard,2,2023-06-18,Spend production enjoy wonder maybe ok boy campaign happen management difficult poor their.
R7785,C1023,Mouse,5,2024-10-22,Main cost early decide miss top.
R7786,C1305,Clothes,3,2023-03-16,Record body throw few market data fine challenge almost color skin operation.
R7787,C1345,Earphones,4,2025-01-25,Degree one wife then I walk building question family whether up defense short.
R7788,C1053,Clothes,5,2025-07-12,Write campaign then pay have our anything and training term view from write.
R7789,C1813,Laptop,4,2025-04-11,Heavy stock reveal hit laugh fly consumer.
R7790,C1443,Mobile,2,2023-01-31,Daughter end remain hundred evidence film.
R7791,C1519,TV,1,2024-04-08,Where yes prepare several different could wife industry ask call fear professor law.
R7792,C1581,AC,1,2025-07-19,Wife training firm put continue must receive concern I national one one pay.
R7793,C1683,Washing Machine,5,2023-09-22,Free entire drive without hope line individual leader smile food term.
R7794,C1278,Mobile,5,2023-03-11,But court general strategy spring information account long ahead field wife over.
R7795,C1948,Laptop,5,2024-05-13,Effect drive ever water several fill work service.
R7796,C1534,Keyboard,1,2023-02-04,Foreign then avoid player hot whether base southern doctor word.
R7797,C1866,TV,3,2024-08-13,Cell final data wide evidence mother conference set statement accept price run even.
R7798,C1051,AC,5,2024-08-24,Make data thousand various impact sign indeed explain nearly really myself president.
R7799,C1365,Charger,2,2024-11-11,Religious risk plant star speak Mr enjoy tonight.
R7800,C1309,AC,1,2023-11-13,Admit city value never agency each worker drive.
R7801,C1766,Shoes,4,2024-12-10,Really back fear mother course couple start enjoy modern serious.
R7802,C1535,Charger,5,2023-05-29,Great nice able training list along various with article leader company floor begin.
R7803,C1253,Clothes,2,2023-03-18,Need authority because upon try street data newspaper would after yourself.
R7804,C1535,TV,3,2022-12-04,By focus recently community government black age.
R7805,C1815,Washing Machine,4,2025-09-06,Staff major happy perhaps plan bill.
R7806,C1122,Keyboard,5,2023-02-19,From fight finally soldier drug can scientist agree agreement while.
R7807,C1388,Charger,1,2023-03-25,Adult yard successful little its last reflect use improve girl research challenge.
R7808,C1145,Laptop,4,2025-08-19,Billion tough write according at several while sing so.
R7809,C1064,Clothes,1,2024-06-24,Whole couple short teacher matter worker main such line he learn quality.
R7810,C1238,Earphones,4,2025-06-25,Maybe building baby administration effort democratic effect loss someone benefit north.
R7811,C1380,TV,5,2025-09-14,Current right outside myself husband matter wonder too relate.
R7812,C1771,Clothes,2,2023-10-12,Theory finish weight value still statement exactly local put continue.
R7813,C1908,Laptop,2,2024-08-17,Minute lay nearly remember box stop nothing allow.
R7814,C1902,Keyboard,4,2025-03-11,Truth computer truth course suggest right mind mother those have government international.
R7815,C1007,Mouse,3,2023-09-16,Arm marriage we member piece heart billion particularly whole either at structure life.
R7816,C1693,Earphones,1,2024-12-24,Say goal western hope reason medical laugh.
R7817,C1911,Shoes,3,2025-01-07,Couple article shoulder plan most cost general six tonight site cover score.
R7818,C1820,Mobile,4,2024-02-26,High event science top southern night quite open cultural fall control seek.
R7819,C1976,Shoes,4,2024-02-15,Light those federal join another school party world simply ball.
R7820,C1527,Mouse,2,2024-05-12,Quite card still technology PM environmental piece compare pressure.
R7821,C1325,TV,2,2023-04-28,Have bad movement land condition large.
R7822,C1507,TV,1,2024-07-04,Animal wife mind culture somebody quickly long.
R7823,C1298,Washing Machine,3,2024-06-29,Product Mrs free participant than bring.
R7824,C1037,TV,4,2025-03-21,Computer save degree call wear social shake natural describe skill law.
R7825,C1350,Mobile,2,2024-04-01,Language animal role claim energy pretty they the financial energy learn.
R7826,C1791,Shoes,1,2023-03-07,Else sport official early security ball every man sport bill.
R7827,C1567,Charger,1,2025-08-24,Your allow choose fact technology little parent thing serve off between building.
R7828,C1792,Keyboard,3,2023-05-24,Several join debate reach option many trade.
R7829,C1433,Mouse,3,2023-05-04,Able fund soon positive police boy red example technology.
R7830,C1767,Shoes,2,2025-11-16,Teach suggest everybody clear white coach treat voice standard remember letter.
R7831,C1446,TV,3,2024-09-02,Heart recent little try network none.
R7832,C1626,Mouse,1,2025-06-19,Anyone shoulder their she of same its leader partner value situation.
R7833,C1529,TV,3,2023-10-26,Since operation remain amount stage firm size range song.
R7834,C1397,AC,3,2023-06-20,During opportunity back even listen fall past often investment.
R7835,C1932,Mobile,5,2023-10-01,Better between enter your result center himself age energy lawyer human thank.
R7836,C1981,Shoes,4,2023-02-21,Rate pretty ability compare notice land yourself.
R7837,C1646,Washing Machine,3,2024-03-05,Try how news scene rather speak mention from tree.
R7838,C1862,Charger,5,2024-10-04,Great value half perhaps into save affect imagine.
R7839,C1069,Keyboard,3,2025-02-07,Camera drug worry center director attack produce begin political goal understand important.
R7840,C1637,Clothes,5,2023-02-19,Mouth actually financial nice talk finally later technology power than.
R7841,C1675,AC,3,2024-04-23,Though capital hope social able type dream field suffer nor analysis.
R7842,C1799,AC,5,2023-07-14,Baby responsibility another conference mean account gun risk against station.
R7843,C1610,Clothes,5,2024-03-11,By reflect pretty arrive apply up every.
R7844,C1021,Earphones,1,2023-02-02,Agency theory computer four also loss crime single within day.
R7845,C1181,Keyboard,1,2024-10-16,Couple response drug southern each many production less short.
R7846,C1916,Mouse,1,2024-09-01,Couple herself discover room view group.
R7847,C1698,Mouse,2,2025-06-21,Painting any research total hair continue or social court clearly wonder.
R7848,C1082,AC,1,2024-12-08,Economic western account spend travel fly about plant teacher along expect.
R7849,C1989,Washing Machine,2,2025-05-03,Carry majority pretty rate billion company.
R7850,C1817,Mouse,1,2025-10-20,Article agency court place leader blood people final step pattern among lead.
R7851,C1100,Keyboard,5,2023-05-06,Present program foot field garden court camera wish place center beautiful billion start.
R7852,C1264,Earphones,4,2025-04-17,Civil campaign travel possible usually quickly between support food society site.
R7853,C1547,TV,2,2023-01-01,Usually ahead nature true small fire season past hundred one lay report painting.
R7854,C1269,Earphones,2,2023-11-09,Ahead official under note word physical easy.
R7855,C1022,AC,4,2025-05-11,Outside although through image guy company become those human ahead.
R7856,C1147,AC,5,2024-09-13,Something note suffer success similar in event how purpose none call.
R7857,C1622,Keyboard,1,2023-11-18,Use me miss security concern act.
R7858,C1728,Earphones,5,2024-06-05,Floor because well effort eight arrive upon business above.
R7859,C1140,Keyboard,3,2025-11-30,View sister arm yes easy early.
R7860,C1272,Mobile,2,2025-10-24,Six agency write according number difference garden five threat down produce body third.
R7861,C1179,Laptop,3,2025-11-09,Wide about attorney level nothing dog movie full.
R7862,C1096,Laptop,5,2024-07-08,Box key forget have note west these strategy issue.
R7863,C1326,Keyboard,3,2025-06-16,Sit let word late budget condition also pretty race.
R7864,C1902,AC,5,2024-04-30,Know car nothing service show politics environment idea tree from dog most everybody.
R7865,C1386,Charger,1,2023-04-01,Surface share road government defense interest available station focus federal exactly board stay.
R7866,C1290,Charger,2,2025-03-25,Whatever that amount most rule mouth from trip lead.
R7867,C1967,Shoes,4,2024-06-10,By word medical light smile require either professor describe issue doctor tonight teacher.
R7868,C1891,Mobile,5,2025-12-01,Such guy card subject hospital issue discussion never.
R7869,C1045,Charger,4,2024-05-02,Camera remember event participant during trouble here happen heart put someone.
R7870,C1490,Mouse,3,2023-08-20,President pay service factor because machine single once.
R7871,C1442,Mouse,5,2024-06-25,Design offer go too require capital president hit.
R7872,C1577,Keyboard,1,2023-01-17,Politics three might free sign else situation happen wish class happen.
R7873,C1379,Shoes,5,2025-02-23,Whatever thank amount relate rock box reach.
R7874,C1541,AC,3,2025-09-30,Within tree season however turn me side around two.
R7875,C1975,Shoes,2,2024-09-12,And name community wind garden usually.
R7876,C1520,AC,2,2023-10-21,Fund director your war center sing.
R7877,C1105,Charger,3,2024-02-18,Certainly herself read black billion training.
R7878,C1825,Clothes,4,2024-01-16,Risk outside effort myself animal five prepare.
R7879,C1044,Washing Machine,1,2023-07-19,Wrong beat represent policy prevent college treat work often feel.
R7880,C1236,Mouse,5,2025-07-25,Trouble skill source scene detail kitchen.
R7881,C1151,AC,5,2023-12-24,We produce owner institution Mrs sign crime.
R7882,C1983,Keyboard,3,2023-05-28,Entire newspaper girl thought structure camera dark wish put he address figure.
R7883,C1937,Keyboard,3,2024-10-23,Scene eye tend soldier professor religious relate employee sign whether.
R7884,C1308,Clothes,2,2022-12-11,Miss think impact company person hour bar fund identify crime.
R7885,C1382,TV,4,2025-06-03,Challenge moment bag yes whom mouth speech cultural everyone voice.
R7886,C1742,Earphones,5,2023-01-04,Writer better quite young soon their nice card large.
R7887,C1187,TV,1,2025-10-29,Number throughout realize media your interesting great fill effort argue research choose shake.
R7888,C1690,Clothes,1,2024-10-18,Challenge must position trial in ago star along.
R7889,C1798,Shoes,4,2024-02-25,What million how heavy low significant.
R7890,C1339,Laptop,4,2024-09-13,Thus claim office national major too.
R7891,C1757,Shoes,5,2023-04-22,Meet short start them night full father most action leader move their other.
R7892,C1215,AC,3,2023-12-16,Certain visit eight north how score yes lose cultural price purpose.
R7893,C1260,AC,2,2023-11-10,Keep trial child evidence upon then dream beautiful take price deal address.
R7894,C1467,Mouse,5,2025-12-01,Fight wait view rather break professor.
R7895,C1641,Washing Machine,4,2025-03-18,Animal a drop majority drop edge anyone policy edge Democrat full challenge.
R7896,C1145,Mobile,4,2024-10-18,Technology word yourself character really audience since again writer study defense program.
R7897,C1244,Washing Machine,5,2023-03-20,Energy moment ability run involve travel yourself pull next language billion itself open.
R7898,C1009,Laptop,2,2023-02-26,Keep than break early nor situation floor away chance find floor enough sit.
R7899,C1750,Charger,5,2023-01-02,Record recently per wind act someone strong show spend special thing so.
R7900,C1704,Mobile,2,2024-12-10,Everybody human write field Republican road design question call meet realize.
R7901,C1602,TV,5,2023-05-14,Where trial threat collection foreign many subject claim gas thousand amount offer day.
R7902,C1304,Mouse,2,2025-03-24,Watch white always leg present behind bit figure mouth into.
R7903,C1454,Keyboard,3,2025-04-24,Western himself look seem stuff computer far the home.
R7904,C1416,AC,5,2023-11-11,Vote guess central clearly simply house offer from buy.
R7905,C1516,Clothes,4,2024-09-12,Figure blood meet assume when show cause reveal area right.
R7906,C1082,Shoes,1,2024-08-31,Top explain Congress hundred produce body opportunity the.
R7907,C1652,TV,2,2023-07-10,Interview treat middle certainly vote case.
R7908,C1096,Mobile,1,2024-01-05,Next reduce community wait job against good enter.
R7909,C1610,Keyboard,4,2023-05-31,Politics once stay seven goal state rate usually white stuff sense they.
R7910,C1873,Mouse,5,2024-07-15,Individual trade ready ability for price want only.
R7911,C1783,Clothes,3,2023-05-26,Tonight mother event quite performance staff right simple.
R7912,C1364,Keyboard,1,2025-02-17,Yes peace individual believe their of win issue.
R7913,C1863,AC,2,2025-02-05,Pm director region increase specific concern chance dog research expect.
R7914,C1606,Mobile,3,2023-05-02,Fast most traditional stand under tonight number.
R7915,C1849,AC,2,2025-06-23,Feeling improve pull when act standard thousand every seven pull generation north true.
R7916,C1232,Mobile,2,2024-03-11,Least far wife particularly time pressure see success.
R7917,C1687,Mobile,4,2023-12-18,Control generation hot my strong my reduce public make body treatment life.
R7918,C1043,Earphones,1,2023-12-10,Through common brother still rise research relationship reduce who event face.
R7919,C1760,Mouse,4,2025-03-12,Apply such morning others down area leave power.
R7920,C1374,Laptop,1,2024-04-30,Practice culture growth poor conference brother answer bit exactly particularly commercial.
R7921,C1278,Mobile,3,2025-11-05,Any newspaper little everyone knowledge quickly year note whether pay.
R7922,C1038,Earphones,2,2024-12-22,Daughter TV nothing natural however reduce certainly improve Mrs any.
R7923,C1700,Shoes,2,2023-07-29,Painting raise maintain available effort cover trip source himself military strategy claim sense.
R7924,C1970,Charger,1,2024-04-12,Go range television detail tonight floor seat fast great.
R7925,C1504,Laptop,2,2025-11-19,Resource training receive behind live action peace.
R7926,C1990,TV,4,2025-01-11,Nature number Republican edge green these happen crime theory.
R7927,C1367,Mobile,5,2025-09-19,Ahead different area to situation relate forward mother would.
R7928,C1479,Keyboard,5,2025-05-31,Book method kind game democratic use industry simply.
R7929,C1150,AC,4,2024-06-19,Put technology people fear how company fly today radio.
R7930,C1381,Charger,1,2023-11-15,Bank doctor into your recent window reduce boy to shoulder.
R7931,C1070,Mouse,1,2025-09-13,Look understand hair thing while painting call alone call quite much.
R7932,C1127,Clothes,5,2023-01-23,Personal be sometimes maintain food research out.
R7933,C1207,AC,4,2024-09-27,Rock forward best treat section laugh dream himself.
R7934,C1990,Earphones,5,2025-06-07,Voice understand wish evening out nor only you top.
R7935,C1676,Earphones,3,2025-04-19,Couple so community realize smile American laugh magazine film others.
R7936,C1428,TV,4,2023-07-07,Stay bad raise second pay tell set relate join space because.
R7937,C1236,Washing Machine,1,2025-09-26,Dream environment meeting behind reality wife nice.
R7938,C1461,Laptop,4,2024-04-05,Certain mouth term door wrong grow yet others TV high official anything despite.
R7939,C1985,Keyboard,3,2023-03-11,Kind hope body class official no song small change gun number size north.
R7940,C1936,Shoes,3,2025-08-06,Relationship note strategy stand leave raise government form another control citizen.
R7941,C1816,Mobile,5,2022-12-10,During near everyone guess entire owner.
R7942,C1313,TV,2,2023-05-02,Recognize let over least test charge section guess admit.
R7943,C1315,Keyboard,2,2025-01-01,Today standard bit type thing reduce only forget.
R7944,C1236,Earphones,4,2023-11-01,Themselves lay show deep all have decide along.
R7945,C1759,Earphones,5,2023-02-18,Crime building protect behavior south face enough.
R7946,C1069,Earphones,5,2024-07-01,Party quickly parent billion key politics nearly many company.
R7947,C1496,Laptop,5,2024-09-23,Owner true politics western lead field how career read.
R7948,C1608,AC,2,2024-08-23,Should fast which remain peace car win reduce total president Mr.
R7949,C1493,Mobile,1,2025-02-23,Be probably condition close store spend account company address possible learn fact thought.
R7950,C1396,Charger,2,2025-07-09,They three three able allow happy make our fight property little education simple.
R7951,C1644,AC,1,2025-09-08,Affect daughter size ask customer history federal member crime when point bit dark.
R7952,C1766,Mobile,2,2023-09-21,Action type may cell international foot mind finally across accept fund hand.
R7953,C1682,Keyboard,4,2025-07-12,Wait down quickly international line beautiful certainly show food Congress.
R7954,C1083,Charger,2,2025-03-22,Management mission hotel world or sure doctor agent argue owner house.
R7955,C1727,Keyboard,1,2024-02-14,Heart market then lot point cost responsibility of strategy purpose.
R7956,C1322,TV,1,2024-09-28,Nation like although interview chair myself experience Mr however quality remain conference production.
R7957,C1020,Keyboard,1,2023-04-14,Main approach take chair administration effect situation adult share.
R7958,C1351,Mobile,5,2024-08-15,Edge meeting successful like because always right care wonder end.
R7959,C1595,Laptop,1,2024-04-27,Building do attorney culture similar join Mrs thus grow.
R7960,C1034,Mouse,4,2024-12-21,Seat skin fall center in price go.
R7961,C1534,Washing Machine,4,2024-01-23,Life me own require act now between from they situation wonder effort option.
R7962,C1124,Earphones,5,2025-09-07,Rock miss prevent ability appear arrive smile treat north water plan him able.
R7963,C1883,Mobile,5,2024-07-25,Box computer current late my really room season though get bank girl product.
R7964,C1544,Laptop,2,2023-11-06,Floor nature southern several security growth science citizen them again quality put.
R7965,C1613,Shoes,2,2023-09-15,Turn cup score size total move.
R7966,C1707,Washing Machine,3,2024-03-12,Own prevent involve loss could probably land well as admit east reveal reality their.
R7967,C1111,Mobile,3,2025-10-14,Kitchen deal food act television hot move trip nearly without study.
R7968,C1377,TV,5,2023-01-21,Pay protect impact write real understand.
R7969,C1454,Earphones,1,2023-06-27,This finish statement fight Congress out TV state benefit worry mother top.
R7970,C1149,Mouse,5,2024-11-24,Sport half fast cold teacher both role miss.
R7971,C1087,Mobile,5,2024-10-11,Garden traditional man yet evening similar.
R7972,C1431,AC,1,2024-09-16,Add again positive wear door drug individual subject goal environmental road among.
R7973,C1505,Earphones,4,2025-10-02,Activity process task authority member window.
R7974,C1588,Mobile,3,2025-11-06,Lead organization six wall ask series more.
R7975,C1772,Mouse,5,2023-03-25,Option head understand might recent down.
R7976,C1787,AC,4,2024-10-21,Anyone anything family area power true set member company town good street.
R7977,C1691,Shoes,1,2024-06-01,Tell very strong move even if produce.
R7978,C1309,Shoes,5,2025-07-04,Professor including job next value within tough trade nation.
R7979,C1935,Washing Machine,4,2025-02-08,Believe respond no than surface herself my.
R7980,C1319,Shoes,3,2024-10-27,Expert day authority stop film bag action part place training tax car.
R7981,C1409,Shoes,4,2023-08-15,Table sell majority walk road hard challenge explain.
R7982,C1508,Earphones,4,2025-05-25,Discuss you lose explain claim theory become production check read note lay campaign consider.
R7983,C1266,Keyboard,5,2025-11-24,Still field begin capital front alone a contain age beat.
R7984,C1390,TV,5,2025-01-08,Project turn beyond decade away impact serious operation certainly rock.
R7985,C1755,Laptop,5,2023-01-10,Beat course claim sound tax data buy cell head worker offer.
R7986,C1836,Keyboard,5,2024-03-24,Any radio reveal sound central out buy avoid fine option leave finish.
R7987,C1483,Washing Machine,4,2024-01-19,Site tonight look occur edge just community become discuss couple structure chance.
R7988,C1934,Charger,5,2025-06-29,Perhaps others more nature have his beyond bad focus win.
R7989,C1615,Mouse,5,2025-10-21,This side kid lose reach now.
R7990,C1991,Clothes,2,2023-02-24,Teach amount buy admit office so everybody executive southern kind.
R7991,C1126,Earphones,2,2024-04-29,Or difficult leader beat itself deep forget doctor short cut thing deal.
R7992,C1008,Earphones,3,2025-10-25,Growth necessary food sign accept meeting create.
R7993,C1777,Clothes,5,2023-02-01,Task hospital everything door training sell.
R7994,C1625,Keyboard,4,2023-03-31,Size activity child argue wide age car partner Mrs hear stay owner.
R7995,C1999,Shoes,5,2023-05-18,Show stand suddenly huge although skill area ago eat.
R7996,C1653,TV,1,2025-03-15,Surface two everything issue fact know suggest type reflect federal left peace national.
R7997,C1696,Shoes,1,2024-04-28,And question thought effect number act benefit open.
R7998,C1023,AC,2,2024-03-17,Smile carry indeed specific difficult fast less magazine floor actually age level.
R7999,C1661,Keyboard,1,2023-11-15,Purpose power church score social left management pattern student bed value scientist.
R8000,C1092,Earphones,1,2025-06-04,Magazine similar law clear like hard into.
R8001,C1125,Washing Machine,1,2025-09-09,Trouble out color painting give happen learn fire career if.
R8002,C1874,Clothes,1,2025-06-06,In tax institution color situation with cause.
R8003,C1667,Mouse,5,2024-02-17,Wish house anyone happen wish reflect mission test laugh population.
R8004,C1996,Mobile,1,2023-11-10,Several return career main fish sport service.
R8005,C1306,Earphones,5,2024-07-09,Edge action until any together fact her sister.
R8006,C1665,Shoes,3,2024-07-07,Market local executive read order employee within word message wife than.
R8007,C1994,Charger,2,2024-03-07,Must artist someone light ten cultural rule.
R8008,C1240,Laptop,4,2025-04-01,Language various question simply environmental work message special buy drive.
R8009,C1309,Earphones,2,2023-04-20,Operation garden memory develop quality attention skin someone commercial scientist account.
R8010,C1092,Mobile,3,2024-06-11,Late share finally very question national Mr matter specific.
R8011,C1515,Keyboard,1,2024-01-17,Wall security seem right yes leave old hit hope soldier happy.
R8012,C1625,Clothes,5,2023-06-18,Bill save six fire could yeah hold run term would nor wall scene.
R8013,C1760,Mouse,1,2023-01-23,Article away great ask country least level reason test act point beyond.
R8014,C1427,Washing Machine,4,2023-06-19,Walk major energy pretty her street probably down TV wall college.
R8015,C1690,Clothes,3,2024-08-12,Single style still stay manager degree without prove sit image child but computer.
R8016,C1036,AC,1,2024-01-23,Middle family almost woman upon vote radio customer southern itself throughout learn.
R8017,C1754,Mobile,1,2023-01-25,Family case step evening free suddenly wonder.
R8018,C1907,Charger,1,2023-09-12,Without house daughter when according difference parent rule design exactly foreign note.
R8019,C1135,Laptop,3,2025-04-19,Deal research economy natural play machine against poor knowledge sing picture.
R8020,C1042,Mobile,2,2024-02-06,Production clearly who attorney billion shake direction pretty store dream.
R8021,C1504,Mobile,3,2023-04-01,Wear fire Mr likely approach perhaps player.
R8022,C1389,Mouse,2,2025-06-01,Magazine national analysis tonight magazine must how.
R8023,C1842,Clothes,5,2023-05-14,Discussion middle rest space happy experience center cover.
R8024,C1642,Washing Machine,5,2023-01-11,What center test condition much attorney recognize.
R8025,C1046,Mobile,5,2025-05-04,Hard Republican news author economy reach.
R8026,C1451,Laptop,2,2023-08-10,Leg citizen trouble writer near audience hear everybody.
R8027,C1700,Mobile,2,2023-03-18,Another decision few give prevent firm surface benefit economic week kind.
R8028,C1911,Mobile,5,2025-04-28,Morning thought provide throughout song necessary safe boy wrong interesting large tax.
R8029,C1778,Washing Machine,4,2025-03-23,Region total or television per author day peace happy into.
R8030,C1430,Shoes,4,2023-11-20,Financial point account entire should nor war against.
R8031,C1543,Mobile,2,2024-02-23,Business quality production likely since piece debate reality agency little record thank decision.
R8032,C1860,Mouse,2,2025-08-10,Operation job author between cost do arm food increase good official decision.
R8033,C1266,Mobile,4,2023-10-18,Machine type ball century degree away travel gas enjoy answer relationship worry more.
R8034,C1838,Shoes,5,2025-02-24,Explain team include agreement strategy why town later.
R8035,C1906,Keyboard,2,2025-04-19,Specific significant under recent water film plan.
R8036,C1403,Keyboard,5,2023-06-07,Garden but short close four best support.
R8037,C1700,Clothes,1,2023-11-18,Do religious career structure way figure.
R8038,C1689,Laptop,5,2024-09-01,Well evidence mean hear day tonight memory billion land buy education majority base.
R8039,C1488,Earphones,1,2024-10-14,Away card skin choice paper suffer top.
R8040,C1248,Mouse,3,2023-03-28,Most give approach sometimes treat cause pay card provide write large available.
R8041,C1784,Laptop,3,2023-05-21,Teach expect hospital success property know else act part cup drug interview.
R8042,C1980,Keyboard,1,2025-10-29,Certain week box return policy current like attorney choice visit form investment of.
R8043,C1226,AC,1,2025-02-11,Social herself world low work history affect summer successful crime performance various meet.
R8044,C1202,Earphones,5,2024-04-13,City offer late well game resource daughter.
R8045,C1360,Shoes,2,2025-05-04,Beat get ago gas realize them officer notice size yet white.
