RatingID,CustomerID,ProductName,Rating,ReviewDate,ReviewText
R5901,C1008,Mouse,2,2024-11-22,Room prove century suggest position several but may police.
R5902,C1729,Laptop,1,2024-12-04,Film tell claim us human reveal face still itself nothing.
R5903,C1777,Keyboard,1,2022-12-08,Hit man ago write as old street expert.
R5904,C1820,Mouse,2,2024-10-31,Marriage than hear imagine hope put language simple money federal north teacher.
R5905,C1668,Clothes,4,2024-05-16,Deal available physical dog process change recent material idea.
R5906,C1264,Earphones,2,2025-06-15,Reflect indeed high budget watch magazine be.
R5907,C1035,Keyboard,1,2024-04-25,Nation however trade side authority expert look commercial morning consumer baby economic entire.
R5908,C1337,Mobile,2,2024-12-16,Whom wall national spring hand others suddenly page kid ability thousand stock marriage.
R5909,C1421,Mobile,3,2025-01-24,Floor anyone think system yet behind sometimes become.
R5910,C1162,Mobile,3,2023-11-08,Than animal front idea finish budget power hour trade source a price such.
R5911,C1579,Shoes,5,2024-10-13,Dog dream our particular national American themselves various put almost.
R5912,C1515,Mobile,3,2023-07-11,Much common old economy everybody trial admit.
R5913,C1027,Washing Machine,3,2025-01-24,Turn shoulder threat arrive not even assume floor sure single.
R5914,C1102,Clothes,4,2023-12-24,Sea throughout skill indeed bill smile girl wall investment your we.
R5915,C1278,Washing Machine,3,2024-11-06,Attorney employee white form then realize bit however why oil.
R5916,C1240,Clothes,1,2022-12-16,Writer certain ok must late really reveal.
R5917,C1043,TV,3,2025-11-03,Speech business make decide employee wonder strategy TV together answer current.
R5918,C1951,Mouse,4,2023-01-21,Really visit write happen very assume.
R5919,C1205,Clothes,4,2023-11-19,Onto community behind the leave talk player bill box citizen.
R5920,C1182,Washing Machine,5,2023-04-11,Save simply each popular speech medical poor.
R5921,C1457,Clothes,3,2024-01-27,Student nearly sport can write record safe whom tonight forget simply themselves.
R5922,C1301,Washing Machine,5,2025-10-04,Another above hear board person activity none left science add heavy pretty.
R5923,C1522,Washing Machine,2,2023-05-28,No animal hand act talk keep bank attack energy fine own will.
R5924,C1979,Mouse,2,2025-11-08,Study commercial state blood network choose.
R5925,C1755,Mouse,4,2024-11-29,Those water director start want space hundred easy.
R5926,C1285,Washing Machine,2,2023-07-09,Quite both run our pattern black interview bank seek.
R5927,C1728,Mouse,3,2023-01-12,Manage film range draw personal far most either reflect he worker play.
R5928,C1177,TV,2,2023-12-18,Total experience share century left produce gun enough building.
R5929,C1444,Washing Machine,3,2023-12-09,Actually continue listen floor pick issue want card good level none cultural.
R5930,C1297,Shoes,2,2025-05-18,Lose party poor agree suddenly statement voice spend finish place.
R5931,C1731,Mouse,2,2024-09-15,Garden after address study view floor have south air go.
R5932,C1884,Charger,3,2025-08-15,Follow deep anything seven nice late reason woman spend safe drop.
R5933,C1300,Washing Machine,3,2025-01-17,Pm should improve agency guy analysis mind.
R5934,C1160,Earphones,5,2024-07-21,Bring move body attention statement dark fine interesting five water total ability across.
R5935,C1771,Mouse,1,2024-07-31,Memory turn positive first whatever speech major whose hundred.
R5936,C1879,Clothes,3,2024-05-31,Catch college arm thousand box pick.
R5937,C1112,Charger,2,2023-01-10,Check miss both mother shoulder sit show which position their.
R5938,C1707,Washing Machine,3,2023-01-13,Increase represent avoid long my begin face total.
R5939,C1905,Keyboard,4,2025-05-21,Billion sport share these sort inside but fund list.
R5940,C1954,Laptop,3,2025-04-03,Family green fly key behind however participant decision could push play top.
R5941,C1168,Mobile,2,2023-05-09,Behind cover improve condition building power leader mind.
R5942,C1446,Mouse,2,2022-12-30,Statement politics less remember anything world page it defense.
R5943,C1718,Shoes,1,2025-05-16,Reveal improve difficult traditional play policy fund character.
R5944,C1170,Mouse,1,2023-10-22,Perhaps road maintain action world own itself piece price either region expect.
R5945,C1822,TV,2,2024-10-26,Court environment party both skill produce use professor explain choice land.
R5946,C1441,Laptop,2,2024-03-01,Kitchen determine cultural eye my start yeah investment.
R5947,C1466,Shoes,4,2023-11-17,Identify next beat floor crime treatment hand small organization draw dream course.
R5948,C1458,Mouse,2,2025-07-27,Budget seem argue physical strategy state book movement.
R5949,C1215,AC,2,2024-08-22,Bring another get account human parent ready back.
R5950,C1515,Clothes,4,2023-05-14,Lead no standard majority poor writer year final.
R5951,C1111,Washing Machine,4,2023-04-10,Result summer every senior catch sign century person spend everyone coach TV.
R5952,C1194,Washing Machine,4,2023-06-16,Or good community successful network office least policy consider owner vote meeting sort.
R5953,C1020,Washing Machine,4,2025-07-26,Training hot machine receive nothing inside such break.
R5954,C1100,Keyboard,5,2024-09-13,Suddenly not well truth agree actually order way responsibility none sense water.
R5955,C1004,Mobile,2,2024-07-17,Claim expect concern will politics structure around recognize final individual design political film.
R5956,C1498,Earphones,5,2023-01-05,Put role could son Republican likely eight same team detail.
R5957,C1177,AC,4,2025-06-04,Tough Democrat Republican painting condition each life treat next political since laugh.
R5958,C1660,Mouse,3,2024-06-15,Four than plan Democrat force finally two according discuss star defense.
R5959,C1729,Shoes,3,2023-08-16,Little majority pressure investment so view remain natural picture worker.
R5960,C1059,AC,2,2023-09-07,Throughout time back coach fire Congress wonder individual travel real.
R5961,C1599,Mouse,2,2023-05-11,Cover technology must either talk bed learn at.
R5962,C1858,Washing Machine,3,2023-03-23,Significant nice little state every religious sport range away draw.
R5963,C1341,Charger,1,2023-10-18,Seek top goal imagine decision structure health much sport entire.
R5964,C1435,Earphones,4,2024-05-23,More long use business skin business open whom say little million standard Republican.
R5965,C1120,Keyboard,3,2024-09-14,Top about however list end our wrong area to carry talk sometimes.
R5966,C1139,Charger,1,2023-10-26,Employee four decision protect center see effort trial after produce yet.
R5967,C1054,Clothes,1,2024-09-21,Her black decade real fear design interview over issue wide sing never reach.
R5968,C1496,Keyboard,4,2023-10-16,Close situation table three team statement three adult technology admit.
R5969,C1750,Laptop,3,2025-10-30,In however tonight relationship summer process.
R5970,C1139,TV,5,2025-10-29,Store team sometimes decide owner kind capital detail behind think station set bar.
R5971,C1735,Washing Machine,5,2024-12-09,Will establish serious in science join.
R5972,C1796,Washing Machine,5,2025-05-01,Imagine material series wall or office practice again result back forget cultural.
R5973,C1521,Mobile,1,2023-05-29,What career speak left may energy force training subject.
R5974,C1147,Washing Machine,4,2024-05-12,Exactly purpose involve people scientist measure or development bar instead easy color either possible.
R5975,C1330,Laptop,4,2023-10-14,Soldier four Congress Democrat but mouth measure important rather along heart several.
R5976,C1036,Laptop,5,2023-10-29,How country maintain common movement individual within window level card tend.
R5977,C1745,AC,1,2024-06-05,Take identify administration thousand former deal receive send best try.
R5978,C1590,Laptop,1,2025-06-14,By affect issue sure miss should rather common build general high argue.
R5979,C1072,Shoes,1,2025-02-23,Win radio scientist do machine economic conference agent.
R5980,C1833,Clothes,1,2024-06-10,Able well speech clearly personal she management.
R5981,C1345,Charger,4,2025-04-14,Cell get meeting science a able give establish late south house bed garden.
R5982,C1037,Mouse,3,2024-06-09,Take anything while weight product various.
R5983,C1576,Earphones,3,2024-07-09,Become single including miss seek baby yard throughout understand method various road.
R5984,C1882,AC,3,2024-05-12,Million meeting staff necessary source memory almost big area four information write million.
R5985,C1215,Laptop,1,2025-08-15,Large civil over quite student often way war.
R5986,C1056,Washing Machine,1,2024-02-07,Seek as service blue will value impact member.
R5987,C1773,Clothes,2,2024-03-18,Seem maybe something child head will detail.
R5988,C1581,Keyboard,5,2025-07-30,Fire family language board model another.
R5989,C1255,Mobile,2,2024-08-30,Picture plan stock about environmental all but data.
R5990,C1617,Keyboard,1,2024-07-21,Him record cell carry activity turn.
R5991,C1277,Mobile,1,2024-06-17,News education fly field rather cause future business.
R5992,C1034,Mouse,1,2025-05-28,Protect fine adult receive defense city blue.
R5993,C1410,Laptop,5,2022-12-15,I administration social the guess world population just high feeling page ago.
R5994,C1091,Charger,5,2024-06-13,Hold increase increase final billion learn hospital likely enough laugh allow public seven.
R5995,C1922,Mobile,5,2023-02-02,Follow want future century southern five.
R5996,C1747,Charger,2,2025-08-27,Speech sound rise grow water administration free TV imagine any single help.
R5997,C1015,TV,2,2024-10-01,Wall back have arrive institution serve decade image opportunity.
R5998,C1495,AC,2,2023-08-31,Feel bad development land we place risk mission among.
R5999,C1032,Washing Machine,1,2024-01-30,Very sport land they friend likely certain decade many city of room.
R6000,C1287,Earphones,2,2023-03-11,Next part pull knowledge cell whether.
R6001,C1215,Laptop,2,2023-05-15,Police stop put some cell page every place ever.
R6002,C1669,Washing Machine,5,2025-10-18,Arm trial maintain I lose five.
R6003,C1282,Mobile,1,2024-10-19,Defense room soldier laugh listen knowledge probably all.
R6004,C1517,Washing Machine,2,2025-08-10,Record save former success summer final recognize during hundred.
R6005,C1289,Laptop,3,2023-04-20,Amount future look kitchen message morning program its standard agency almost.
R6006,C1011,Mobile,4,2025-05-14,Form dinner process weight development company.
R6007,C1801,Charger,4,2025-04-14,Republican cost adult figure particular fast or wish mean them.
R6008,C1269,Keyboard,1,2025-04-16,Wrong must suggest report section study my message according speak himself discover you.
R6009,C1599,Shoes,4,2023-10-11,Argue face ball Mrs young have water health.
R6010,C1134,Clothes,1,2024-02-29,Marriage his consider set catch especially.
R6011,C1025,AC,2,2024-03-15,Environmental avoid happy trade possible federal story service oil want woman require.
R6012,C1587,Clothes,4,2023-12-05,New wind amount everybody claim image social son every three boy.
R6013,C1010,Earphones,3,2024-04-14,Summer important eat increase control none maybe get your own.
R6014,C1832,AC,5,2023-12-27,Because report stay only film network.
R6015,C1287,Mouse,4,2025-03-05,Authority professor floor score walk bank million many continue soon purpose beat because.
R6016,C1687,TV,5,2024-10-19,Field join effect low quickly I own.
R6017,C1506,Laptop,4,2024-03-11,Attack relate glass baby car weight.
R6018,C1592,Mobile,1,2023-05-30,Way participant hundred adult control issue phone rock ground stuff environmental Democrat.
R6019,C1380,Earphones,1,2023-02-23,Environment common green tax explain left natural within hour.
R6020,C1975,AC,3,2025-03-10,Trip really tough smile quickly result leg work to.
R6021,C1577,Laptop,3,2025-08-23,Talk consumer nature memory decide I respond drop.
R6022,C1624,TV,5,2024-04-06,Mother book community meet care while no charge task network family.
R6023,C1583,AC,5,2025-11-25,Certainly get sit maintain scene impact rock push vote become.
R6024,C1380,Mouse,5,2025-09-18,Tv send early believe according trip major image up west.
R6025,C1356,Charger,1,2024-11-02,Study nothing your number hot investment what wait understand politics identify everything.
R6026,C1129,Keyboard,5,2025-05-29,Road natural hold poor goal structure college.
R6027,C1457,Laptop,2,2023-05-19,Significant his whom hand position cold mean against raise their maintain within.
R6028,C1819,Mobile,3,2025-03-07,Lay that school staff ever down owner choice both.
R6029,C1751,Mouse,5,2024-05-17,Meeting cell stay outside week even.
R6030,C1278,Mobile,2,2023-02-22,As data side happy national later give direction should popular once because Mrs.
R6031,C1807,Keyboard,3,2023-06-25,Catch think top enough may strong life standard return happen.
R6032,C1678,Mobile,2,2024-11-26,Wrong want never identify successful cost where.
R6033,C1999,Charger,1,2023-11-14,Practice television which forget discuss range put PM natural.
R6034,C1235,TV,5,2023-03-25,Able team eye break nice treatment heart key stage visit agree race early.
R6035,C1914,Shoes,4,2024-11-15,Response but especially behavior onto market choice right not everyone approach.
R6036,C1860,Washing Machine,2,2024-01-12,Significant scientist send movement sell year type reduce even couple.
R6037,C1044,Charger,1,2024-06-15,Show education owner however town write summer guy.
R6038,C1817,Earphones,2,2024-02-16,Sea after culture enter skin in we skill night front around art.
R6039,C1231,Clothes,4,2023-04-05,Position quite with him still card discuss adult thought short.
R6040,C1010,Keyboard,2,2025-08-28,Sit magazine statement medical make ten.
R6041,C1210,Clothes,5,2024-02-24,Enough hope two wish spring pretty decide born.
R6042,C1631,Charger,2,2023-07-05,Fire experience tell guy share commercial reach individual.
R6043,C1314,Washing Machine,1,2023-02-06,Bring source situation peace trade half area nice money dog action cultural.
R6044,C1247,Charger,2,2025-05-09,Middle outside class fire require address ok evening hot day buy seem relate.
R6045,C1450,Keyboard,1,2023-03-14,Person laugh about common provide industry carry foreign dark issue.
R6046,C1580,Mouse,2,2024-10-02,Environmental lose through TV clear expect human again owner rule drive.
R6047,C1739,Clothes,1,2025-10-28,Audience radio whether back surface attorney even pressure run.
R6048,C1121,Earphones,2,2025-11-19,Energy improve weight office doctor present blood yard executive any drug walk give.
R6049,C1596,Washing Machine,4,2025-09-28,East generation power head hotel entire whether music deal.
R6050,C1519,AC,3,2024-02-14,Structure responsibility color include employee there.
R6051,C1023,Mouse,2,2025-10-20,Control religious federal measure fire heart national.
R6052,C1194,Earphones,2,2025-06-09,Team final audience technology election culture team statement series region off take.
R6053,C1208,Mouse,4,2023-09-01,Chance campaign exist back area certain relate personal rest hand unit suffer.
R6054,C1306,Mobile,4,2023-01-08,Really center yourself under establish myself majority message.
R6055,C1299,Keyboard,1,2023-03-07,Prepare option middle common all none degree difficult blood piece right environment environment mission.
R6056,C1033,Charger,4,2025-01-16,Event item north sometimes recently surface public power probably six.
R6057,C1396,Shoes,3,2023-06-20,Former election check consider sign ask cup right.
R6058,C1120,Clothes,2,2023-06-02,Man respond step dream large accept.
R6059,C1276,Washing Machine,5,2022-12-13,Fear board save capital Congress Congress defense for.
R6060,C1558,Mobile,4,2023-02-26,Exactly adult take war only improve.
R6061,C1549,Clothes,5,2024-09-13,Agreement interview professor develop season beat his be happen spring garden health cup.
R6062,C1518,Laptop,1,2022-12-14,Entire Republican begin story style early.
R6063,C1187,Clothes,4,2022-12-08,Rather south choose data against debate protect through cold.
R6064,C1337,Clothes,4,2025-10-02,Middle design doctor activity clearly first again small approach want our trip.
R6065,C1950,Washing Machine,1,2025-07-09,Billion worker hand hot eight method health affect consider respond many.
R6066,C1132,Keyboard,3,2024-05-09,Movement player the maintain everybody answer situation itself left election course.
R6067,C1946,Earphones,4,2023-05-22,Vote research she hear Democrat catch.
R6068,C1674,AC,5,2024-09-26,Popular forget huge old protect politics often always fact.
R6069,C1759,Clothes,5,2024-10-27,Check religious same hotel once best official yes.
R6070,C1041,Washing Machine,3,2023-03-19,Financial stuff beautiful involve for large interest how image he per.
R6071,C1987,Shoes,5,2025-09-14,Agree exist second film collection anything court official.
R6072,C1504,Clothes,4,2025-08-16,Again stuff statement section both piece effect.
R6073,C1072,Clothes,5,2025-10-22,Suffer plant could detail center couple road.
R6074,C1788,Washing Machine,2,2024-05-06,Record group town trade born fine edge scientist understand.
R6075,C1292,Earphones,4,2024-02-02,Whose situation try on skin total develop hand short director center machine pay.
R6076,C1549,Washing Machine,5,2023-09-22,Worker industry rich worker toward eat color society key forward determine market.
R6077,C1391,Keyboard,3,2025-09-16,Experience thousand involve treatment herself person stay measure stuff.
R6078,C1594,Clothes,3,2023-01-28,Director identify newspaper kitchen likely event major yet maintain customer him almost.
R6079,C1469,Clothes,4,2025-03-31,Piece class window memory contain market perform run figure cold.
R6080,C1072,AC,5,2025-06-10,Green rule manager evidence day any have think focus provide.
R6081,C1590,TV,2,2023-05-24,Of tree news risk cold others blue close traditional interesting lot local.
R6082,C1179,Charger,3,2024-07-23,Deep job financial success necessary serious glass space to they.
R6083,C1959,Laptop,5,2024-08-10,Black table star machine each thus take American quickly so which.
R6084,C1438,Mouse,5,2025-03-31,Maintain TV participant above guy create toward main public already executive.
R6085,C1771,AC,5,2024-04-22,Wife husband kid stand wear level send common including imagine food piece thus.
R6086,C1380,Keyboard,5,2025-01-21,Our collection eye seat look fine.
R6087,C1677,Earphones,2,2023-04-05,Generation explain cost indicate who those.
R6088,C1553,Keyboard,2,2023-05-23,Nature military way require be enough act.
R6089,C1547,Shoes,2,2025-06-05,From friend them cost role dog debate start agent sort race power president.
R6090,C1912,TV,2,2025-05-22,Magazine everyone green matter nation management wall benefit most serious thank.
R6091,C1514,Washing Machine,2,2024-03-05,Writer group wide action become hot especially both.
R6092,C1794,Clothes,5,2025-05-19,View management wish all former music mouth support environment establish.
R6093,C1025,Earphones,5,2025-03-26,New with side story memory model.
R6094,C1660,Keyboard,3,2023-11-01,Cell environmental forget less than chair happy.
R6095,C1496,Earphones,2,2024-08-23,Foot service culture itself whether try control yet south financial involve chair old.
R6096,C1068,Mobile,5,2024-01-16,Need them full ok remember occur alone according spring material toward positive development.
R6097,C1871,Mouse,3,2025-05-02,Agency big compare stuff rest score.
R6098,C1987,Laptop,5,2023-08-17,Yeah others mission evening sort position guess.
R6099,C1121,Mouse,1,2025-01-13,Quality candidate movement south camera people.
R6100,C1053,Washing Machine,5,2023-01-31,Argue agency just story level art final article.
R6101,C1917,Earphones,4,2023-07-24,Despite always drop once election avoid.
R6102,C1215,TV,3,2023-03-30,Street so remain yeah why market.
R6103,C1678,Mobile,5,2024-09-05,After natural teach call magazine project development born old.
R6104,C1252,AC,1,2025-04-20,Southern certain choice history guess short until.
R6105,C1592,TV,3,2025-08-12,But view environment system table remain.
R6106,C1518,Washing Machine,1,2023-07-08,Forward might compare official admit mind scene away modern item.
R6107,C1457,Washing Machine,1,2024-12-30,Myself contain she daughter culture boy local central different will news piece.
R6108,C1624,Mobile,1,2023-04-15,Movie catch form under down can fly company.
R6109,C1733,Keyboard,2,2023-05-24,Marriage audience tough before name minute put degree suffer local work.
R6110,C1696,Earphones,3,2024-02-09,Citizen describe group southern program and develop direction economy safe poor.
R6111,C1979,Laptop,2,2023-06-02,Happen most single ability money property baby inside toward.
R6112,C1274,Shoes,2,2023-07-28,Manage enough sometimes entire white three top peace reduce policy.
R6113,C1622,Mouse,1,2023-09-08,Need if why use project government control expect somebody.
R6114,C1868,Washing Machine,3,2023-06-29,Great example white contain sea set shake teach.
R6115,C1620,Clothes,2,2025-10-01,Per senior keep beautiful still from maintain source hotel.
R6116,C1702,AC,5,2024-07-07,Message action movement course during book receive decide.
R6117,C1027,Earphones,1,2025-03-06,Once buy perform maybe American late age.
R6118,C1421,Mouse,3,2025-05-04,Mr nice two century late bar.
R6119,C1059,Laptop,5,2024-10-30,Particularly person shoulder thousand lead know image up second conference feel yard itself.
R6120,C1170,Charger,1,2023-05-14,Red others three leave ability ask seat smile crime common garden sense.
R6121,C1234,Charger,2,2023-11-28,Financial away well plant middle your site later industry campaign common middle.
R6122,C1072,AC,5,2024-09-13,Popular risk central on start bad represent decision.
R6123,C1371,TV,4,2024-04-12,It star shake thought even bit better.
R6124,C1657,Laptop,3,2025-09-09,Leader could employee they board support.
R6125,C1249,Mouse,1,2025-03-15,Act bring somebody they spring eat many usually nice magazine rest poor yes.
R6126,C1980,Laptop,2,2025-06-01,Respond test now give responsibility leg series personal light full bring alone every.
R6127,C1525,AC,2,2025-06-12,Space item with trouble son drop surface approach medical office card.
R6128,C1688,Keyboard,1,2024-04-10,When strong pressure not represent pattern close.
R6129,C1573,Washing Machine,5,2024-07-28,On about American pull remain them community gas notice require family evidence own.
R6130,C1825,Shoes,4,2025-03-29,Word nothing work ok that in paper call.
R6131,C1797,Mobile,3,2025-01-03,Sort matter well peace manager truth wrong.
R6132,C1091,Mobile,4,2025-06-07,Past remain which side certain born week million another one low building.
R6133,C1331,Charger,2,2025-09-05,Son family these theory maintain kid plan.
R6134,C1934,Keyboard,4,2023-07-26,Like former commercial learn good place international sense even pick when.
R6135,C1328,Shoes,3,2023-02-04,Stand space central after high door.
R6136,C1962,Charger,3,2025-02-28,Particularly fund condition our team him anyone yes.
R6137,C1547,Washing Machine,3,2024-11-16,Less wish site minute away he make attack under.
R6138,C1227,Clothes,5,2023-07-18,Reach get enter cut necessary science idea rule worker late my family.
R6139,C1438,Clothes,2,2023-01-17,Language day organization Democrat do coach material book program price bar we way.
R6140,C1211,Keyboard,3,2024-10-10,Instead hold listen business front strong address believe phone century like stock.
R6141,C1066,Mouse,2,2025-11-01,Issue dinner program yeah skill hard law hair see indeed building.
R6142,C1280,AC,3,2025-01-03,Ground federal human expect store energy everyone good financial loss her well care.
R6143,C1634,Clothes,5,2023-05-14,Fear administration land tonight event theory these morning.
R6144,C1166,Keyboard,2,2025-08-24,Social you appear discuss likely space region know quite may place parent.
R6145,C1510,Clothes,4,2024-10-19,Loss thousand high money be act wear with.
R6146,C1925,Laptop,4,2022-12-24,And art discussion maintain certainly specific.
R6147,C1580,Washing Machine,1,2025-09-07,Stock with yeah whole major despite talk fact like form often.
R6148,C1377,Washing Machine,1,2025-02-21,Down difference on camera attack off entire matter teacher about very garden page.
R6149,C1456,Earphones,2,2025-10-21,Assume laugh win both produce though even maintain now entire according character challenge.
R6150,C1839,Shoes,4,2023-02-10,Give away type book class international color spend hotel soon allow type.
R6151,C1960,AC,5,2025-02-26,Style race nation force toward election that usually.
R6152,C1571,Mouse,3,2023-08-23,Performance station thing toward occur trip major me.
R6153,C1299,Mobile,4,2023-02-18,Know indeed during take business test near summer.
R6154,C1700,Laptop,5,2024-02-05,Well family yeah coach party network white TV network occur than Mrs heavy.
R6155,C1810,Washing Machine,1,2025-08-03,Threat what training group book show there develop per social not force feel.
R6156,C1562,Charger,1,2025-11-07,Candidate west author risk more son.
R6157,C1182,Clothes,2,2025-09-26,Edge major price enjoy painting develop career for.
R6158,C1455,TV,3,2024-02-16,Different meeting north inside turn too worker.
R6159,C1602,Keyboard,2,2025-05-02,Go economy tree health push decade note.
R6160,C1791,Charger,3,2023-07-21,Natural unit level throw part community.
R6161,C1952,AC,3,2025-07-05,Allow loss east less certainly amount full number hand.
R6162,C1299,Laptop,1,2023-09-07,Range always certain produce place responsibility federal specific vote miss outside.
R6163,C1559,Mobile,5,2024-05-04,Drive individual around budget civil treatment upon seat money water debate.
R6164,C1097,Shoes,1,2025-04-06,Focus material until better down foreign player bank interview experience nor end stock.
R6165,C1968,Charger,1,2023-03-28,Rate community past take energy mouth world if school bill.
R6166,C1520,Earphones,2,2024-10-05,Different heavy team cup expect several.
R6167,C1377,Keyboard,4,2025-04-26,Likely long both measure itself tonight despite matter recent necessary.
