RatingID,CustomerID,ProductName,Rating,ReviewDate,ReviewText
R9944,C1912,TV,1,2024-11-28,Task itself game since international card rise view say PM myself finally.
R9945,C1938,Clothes,5,2023-01-01,Cover human red land American sister.
R9946,C1488,Earphones,5,2023-08-29,Impact option dream per source important young.
R9947,C1510,Earphones,4,2025-07-21,Whom check cover discussion page we government recently.
R9948,C1490,Earphones,3,2024-04-01,Skill executive back need position camera.
R9949,C1520,TV,3,2023-09-30,Cultural thus situation dark happen although.
R9950,C1791,TV,3,2023-12-03,Party financial away two idea sure live space three must line happen campaign.
R9951,C1659,Earphones,4,2024-03-30,Until wide rock year town rich article score day.
R9952,C1575,Washing Machine,4,2023-04-16,Behind financial financial task avoid threat better help sell.
R9953,C1286,Charger,5,2023-11-22,Response lawyer reach month scientist agree tell total whole.
R9954,C1401,Mobile,1,2025-10-15,Night prepare early situation add provide work cultural whether impact save every yard trouble.
R9955,C1755,Mouse,4,2023-03-07,End family beat network mission election in to.
R9956,C1727,AC,4,2025-08-20,Benefit thank these film forget recognize light add.
R9957,C1652,Washing Machine,2,2024-09-25,Whose heavy bring week including human reveal any common.
R9958,C1338,Earphones,4,2024-11-27,College company good blood become sport similar plant quite.
R9959,C1266,Shoes,1,2024-12-17,Though decade another hotel senior mouth behavior.
R9960,C1558,Keyboard,5,2023-08-04,Fall live risk break indeed husband official true.
R9961,C1436,Earphones,3,2023-07-22,Clear head rather stand loss suffer.
R9962,C1667,TV,3,2024-12-16,Across region newspaper husband fight if company.
R9963,C1108,Mouse,4,2025-08-31,Note week foreign raise institution nice item beat response then old.
R9964,C1029,Laptop,1,2022-12-09,Fear force cultural argue happen class education network nothing southern.
R9965,C1490,Laptop,2,2023-01-12,Reason particularly smile what off yet.
R9966,C1153,Keyboard,2,2024-03-28,Scene everybody expert campaign year admit rest walk director child mention should thousand.
R9967,C1295,Laptop,5,2023-09-19,Include recent responsibility world later charge owner front down sister friend budget.
R9968,C1544,Keyboard,5,2023-11-20,Success good inside course future meeting book.
R9969,C1002,Clothes,3,2024-09-16,President scientist discuss get today player rich both ask institution second very.
R9970,C1619,Keyboard,2,2024-04-06,Action positive type carry design business conference expert agent.
R9971,C1349,Mouse,1,2025-02-22,Perhaps peace quickly plan training low accept both management experience.
R9972,C1190,Keyboard,4,2025-04-29,Quickly product again one concern pass listen.
R9973,C1503,TV,3,2024-01-07,Involve network month peace hit that behind yard court probably win.
R9974,C1312,Washing Machine,3,2025-09-17,South more lose doctor area friend lose adult green participant big me.
R9975,C1908,Keyboard,3,2024-04-11,Specific sister represent whose work board training story.
R9976,C1516,Washing Machine,2,2024-06-06,Authority place keep risk try matter officer owner fund.
R9977,C1862,Mobile,5,2025-04-24,Listen cultural produce among later nearly pattern.
R9978,C1442,AC,3,2025-02-19,Sort owner chair near create city clear whom list customer seem.
R9979,C1919,Clothes,1,2025-02-28,Great nor write help sense explain.
R9980,C1387,Clothes,5,2025-08-28,Feeling network last dream blood summer week movie statement.
R9981,C1025,Keyboard,3,2024-04-18,System factor sense begin probably themselves.
R9982,C1054,Clothes,2,2024-02-16,Appear modern happy laugh among perhaps why although industry brother appear direction.
R9983,C1076,Mobile,1,2023-12-20,Cultural open air local customer church learn this while so.
R9984,C1892,Clothes,1,2025-10-16,Tough agree consider hair game red statement work old lawyer put.
R9985,C1580,Clothes,2,2024-01-31,Education author debate reach always environmental low Mrs debate support subject drop reason.
R9986,C1444,Clothes,1,2023-05-26,Cause knowledge arm figure other middle assume campaign figure.
R9987,C1985,Charger,1,2024-05-02,Mr technology war degree western step bad possible former song discover interview only.
R9988,C1509,Mobile,4,2024-04-11,Base develop certain research manage she.
R9989,C1258,Mouse,2,2023-11-02,Must rest sister middle central phone including stop outside hotel relate.
R9990,C1975,Washing Machine,3,2024-10-10,Short nature center now article war prepare industry method instead nothing too.
R9991,C1505,TV,3,2023-07-04,Use increase represent what accept modern herself success.
R9992,C1515,Laptop,2,2025-10-01,Clear nothing play green civil husband stage Democrat.
R9993,C1708,Shoes,2,2025-05-07,Different personal answer less rule industry whatever.
R9994,C1464,Shoes,1,2022-12-19,Across hope rather spend operation activity open dark concern grow direction father affect.
R9995,C1915,Mobile,2,2025-07-12,Sit news set class difficult bill level trial then maybe score indicate.
R9996,C1312,AC,1,2024-10-10,Condition plan with state experience half agent.
R9997,C1592,Mobile,5,2023-05-15,Respond behind enjoy chance color fish material.
R9998,C1722,Charger,1,2023-09-15,Have have improve perhaps ahead stuff knowledge entire rule.
R9999,C1059,Mobile,2,2024-11-08,Idea church office doctor either with case administration.
R10000,C1796,Washing Machine,4,2025-10-27,Able ten head state necessary remember become compare garden local boy public.
R10001,C1264,Mouse,2,2025-07-09,Tend event simply job ok stay.
R10002,C1727,Mobile,4,2025-11-03,Home material home fund figure real according international authority dark respond probably always.
R10003,C1762,Charger,1,2023-12-26,Fish newspaper traditional degree maintain artist eight administration have their east care future.
R10004,C1592,Shoes,4,2023-05-13,Home successful attention stuff listen see you cost.
R10005,C1495,Clothes,1,2025-11-05,Major maintain into doctor run smile hour throughout support do ten.
R10006,C1996,Washing Machine,5,2023-10-01,Financial impact car now tell some.
R10007,C1647,Shoes,3,2024-11-02,Summer model under medical pay she every.
R10008,C1691,Charger,3,2024-01-09,Note avoid whose trouble but organization act member.
R10009,C1594,Earphones,2,2023-10-14,Sit price box guess drop until.
R10010,C1278,Earphones,1,2025-08-22,Sign seat everything fish laugh light sure church.
R10011,C1287,Clothes,4,2024-01-08,Study six although pressure land parent on her manager them travel contain.
R10012,C1165,Mouse,1,2025-01-26,Religious work interview door line month important perform describe.
R10013,C1618,AC,1,2024-07-16,Medical often method degree clear main here draw political begin perhaps alone other.
R10014,C1947,Clothes,1,2024-09-14,Well fast after continue apply media.
R10015,C1772,Mobile,1,2025-03-04,Old both design result claim campaign east light play plant attack.
R10016,C1398,Charger,4,2024-08-24,Office note article budget security out respond approach.
R10017,C1391,Charger,1,2025-06-24,Them design live one maintain fine agent notice.
R10018,C1351,Keyboard,1,2024-01-18,New others attention suggest authority age station nice hour off still charge quality.
R10019,C1624,Charger,4,2025-08-17,Matter wonder decision in point firm environmental standard there.
R10020,C1975,Clothes,5,2025-01-28,Team forget opportunity Democrat act rest see good expert foot suggest.
R10021,C1479,Earphones,4,2024-01-11,Article any bring modern ball let manager.
R10022,C1106,Earphones,2,2023-09-14,Environment modern pattern group glass whether page require.
R10023,C1027,Shoes,5,2025-02-10,Less exist character tough produce wish many forward fine.
R10024,C1275,Keyboard,5,2025-04-26,Figure charge face region suddenly pay start single measure.
R10025,C1626,Earphones,1,2023-03-15,Result relationship million call half party laugh relationship others.
R10026,C1624,Shoes,3,2023-12-30,Instead central agreement soldier affect entire audience school class.
R10027,C1885,Shoes,1,2025-08-17,Not from language anything blue we we civil write mention cold.
R10028,C1295,Keyboard,4,2024-10-12,Now development join present main property court.
R10029,C1400,Shoes,4,2024-03-13,Eight speech tend throughout send central tell team.
R10030,C1894,Mobile,4,2022-12-08,Too local pick car movie large entire party how describe meeting away various.
R10031,C1817,Charger,4,2025-05-17,What result guy guy ok customer man media hair.
R10032,C1669,Washing Machine,5,2023-12-03,Team certain cost someone prove throw situation suddenly its put artist sell.
R10033,C1174,Mobile,5,2025-11-29,Last final beautiful room individual box service.
R10034,C1061,Mouse,4,2025-01-13,From cut matter early opportunity cut movie.
R10035,C1279,AC,1,2024-06-23,Both would civil water religious with out feel stay purpose various field enjoy.
R10036,C1165,Washing Machine,4,2023-06-22,Each skill big owner offer action campaign reveal age spring article.
R10037,C1247,Earphones,5,2024-07-24,Light account some major meet anyone shake research college cultural interest probably save.
R10038,C1941,Earphones,3,2025-05-15,Whether spend work marriage low condition paper rich half store wear.
R10039,C1393,Keyboard,5,2024-11-13,Perhaps pass hundred whole side matter company remain ahead give enough big stuff.
R10040,C1155,Earphones,3,2024-12-28,Huge top recently when consider always resource something training door.
R10041,C1474,Clothes,2,2025-10-13,End color with positive science vote answer.
R10042,C1912,Mouse,3,2023-05-07,Side possible happy traditional decide reveal wide keep book purpose table religious.
R10043,C1525,Mouse,1,2025-09-20,Impact where loss between week store doctor Mrs.
R10044,C1050,Mobile,2,2023-06-23,Nation today close international rise Mr dinner single identify her.
R10045,C1703,Earphones,2,2024-05-15,Might later age low tree when.
R10046,C1250,Earphones,1,2025-03-25,Could value successful contain PM fire yard cause step job career expert.
R10047,C1528,Washing Machine,3,2023-07-25,Cell next under food attention nearly hold sister your pass admit stop.
R10048,C1767,Mobile,3,2023-05-11,Table adult rather peace south fine.
R10049,C1380,TV,3,2023-12-22,Over deep official doctor son trade wife.
R10050,C1951,Mobile,2,2024-11-08,He according surface hundred industry sense happy morning.
R10051,C1423,Mouse,4,2025-10-06,Follow scientist stage science they skin of decide evening.
R10052,C1314,TV,5,2023-07-04,Remain maybe lawyer green soldier require shoulder stage allow quite accept end.
R10053,C1058,Mouse,4,2025-10-01,Add fall knowledge enjoy drop beat environmental high per ability politics son chair.
R10054,C1285,Keyboard,4,2024-03-25,Mr effort go upon cup hit success some medical to would even.
R10055,C1707,Mouse,3,2023-12-07,Myself middle season who suggest investment perform foreign you bank strategy.
R10056,C1839,Washing Machine,4,2023-04-02,Energy remain plant specific cause admit.
R10057,C1569,Charger,3,2025-09-29,Past fast during color fill bank.
R10058,C1395,Charger,2,2024-12-10,Either return wear against build poor light.
R10059,C1138,Laptop,4,2023-08-13,Important market several news several money head much but various fund.
R10060,C1306,Shoes,1,2024-08-05,Road government world argue him employee short health foot.
R10061,C1089,Washing Machine,3,2023-10-24,Guy key sport agree instead office identify center plant cold ahead.
R10062,C1581,Mobile,1,2025-01-02,Ready why what culture under environment choice language factor television doctor imagine.
R10063,C1124,Laptop,4,2025-07-30,Way yet try hold owner environmental civil hold concern issue fund produce economy.
R10064,C1941,Washing Machine,1,2024-05-02,Room dark east pressure purpose street only month indicate prove great dream.
R10065,C1601,Shoes,5,2023-11-03,Executive society will offer manage head until.
R10066,C1150,Shoes,2,2025-01-17,Or population source attention popular power decade perhaps station wall all produce woman.
R10067,C1855,Mouse,5,2025-08-27,Win my model west power policy help field network near.
R10068,C1266,Washing Machine,2,2025-09-21,Argue mission tend open professor get business fall identify them.
R10069,C1014,Earphones,3,2022-12-29,World hair several rule southern enter exactly certainly.
R10070,C1698,TV,3,2025-09-12,Father store military teach from among hundred.
R10071,C1005,AC,3,2025-11-13,Able particular fact population simple claim.
R10072,C1954,Clothes,5,2022-12-27,Forward rather travel anything ask power dark worry woman several task event.
R10073,C1861,Mobile,2,2024-05-08,Though wind necessary attention high country.
R10074,C1713,TV,4,2025-06-22,These parent those food interesting career enough drop arm race best dream.
R10075,C1764,Mouse,1,2025-08-22,Reach pressure result simply success become thank environmental smile word computer western.
R10076,C1344,Washing Machine,5,2024-02-22,Will mother song image third decade beat answer set foreign line attack brother.
R10077,C1597,Laptop,3,2024-08-11,Expert enter themselves history area political.
R10078,C1258,Earphones,5,2025-06-08,Way lose wall central truth audience address continue huge attack lawyer.
R10079,C1491,Washing Machine,2,2024-11-16,From black member at close any employee soldier.
R10080,C1688,Earphones,4,2025-03-12,Current example establish contain recognize thought.
R10081,C1168,Mobile,1,2025-12-01,Environment indicate program him tree fine state great year story.
R10082,C1078,Earphones,1,2024-02-25,Dog picture others something defense best finish show could military win art test.
R10083,C1453,Mouse,5,2023-08-15,Prepare decade allow someone business wait foot every get else.
R10084,C1736,Clothes,2,2023-07-05,Lead college exist job decide condition my blood professional cold him water.
R10085,C1346,AC,3,2024-01-25,Sit state brother computer wrong act hospital last poor strategy.
R10086,C1126,Keyboard,1,2024-05-09,Nothing officer clearly article type certain because but get.
R10087,C1670,AC,5,2025-06-06,Subject adult production scientist then everyone maybe sit.
R10088,C1404,Keyboard,5,2024-05-21,Close two rest sing heavy difference.
R10089,C1204,TV,3,2025-09-15,Many myself executive money stage professional trial history paper.
R10090,C1403,Mouse,1,2022-12-15,Manager own decade even two skill hold what response late fund adult.
R10091,C1540,AC,4,2023-11-08,Area hot network heart might determine century feeling mouth area such probably your.
R10092,C1034,Mobile,4,2024-02-07,Though subject medical air main check cost help media south.
R10093,C1303,Clothes,5,2023-05-16,Night management least paper international time food family all.
R10094,C1535,Mouse,4,2024-04-08,Type rich local during catch five score.
R10095,C1347,Laptop,1,2025-02-15,Site answer become music assume way economic.
R10096,C1857,TV,2,2024-04-29,Tough hotel stop early style report reality eye result score point work.
R10097,C1345,AC,2,2024-07-22,Huge kid west remain between hold education seem product.
R10098,C1378,Washing Machine,1,2025-01-15,Method or field eat pay morning either.
R10099,C1398,Clothes,4,2024-10-14,Example station fish up state view expect minute.
R10100,C1123,Charger,3,2023-11-21,Resource analysis strategy authority especially agree face arm write professor interview.
R10101,C1132,Washing Machine,3,2023-09-30,Owner administration fill consumer far finally.
R10102,C1110,AC,3,2024-11-04,Everything seek half change main describe.
R10103,C1075,Laptop,3,2024-08-27,Concern early method pressure around seem all south left break size network.
R10104,C1252,Washing Machine,4,2024-09-10,Responsibility week item fall six away wear alone PM policy.
R10105,C1020,Mouse,5,2023-12-20,Have door why back after single agreement agency if worker along around clearly.
R10106,C1705,Charger,4,2023-05-24,Card news during well clear late ability decision reflect serious focus.
R10107,C1410,Laptop,1,2024-04-16,Actually form authority clearly my with try grow number fire.
R10108,C1083,Washing Machine,4,2023-03-12,Kitchen product create their system analysis situation morning experience day item.
R10109,C1371,AC,1,2023-01-16,Tv again summer commercial eye movement likely save star home down reality.
R10110,C1173,Charger,3,2024-09-17,Plant word pick poor trade national will actually guy follow movie.
R10111,C1134,Earphones,3,2023-08-14,Look value challenge surface something stand player former others record.
R10112,C1965,Keyboard,3,2025-10-25,Front green report discuss various occur bill speak full others black.
R10113,C1064,Keyboard,4,2023-06-14,Do risk mind rock when dark individual form support.
R10114,C1653,Charger,3,2024-12-21,Treat everything wall history car strategy.
R10115,C1476,Keyboard,3,2023-01-20,Accept fish anyone just wall service policy exactly similar simply.
R10116,C1196,Shoes,4,2024-12-23,Assume difference lose necessary late rest another plan head person popular.
R10117,C1894,AC,4,2024-11-24,Hard in change born early our continue statement want we.
R10118,C1281,TV,1,2023-08-07,Travel same truth visit ahead participant budget writer fine prove magazine.
R10119,C1858,Mobile,2,2024-12-23,Possible everything size your include her agent wide.
R10120,C1350,Washing Machine,3,2024-10-30,Different college on rock pattern guy very whom.
R10121,C1340,Charger,5,2025-05-19,Local energy year main test best add baby receive type prove east role.
R10122,C1297,Earphones,2,2024-10-10,Goal choose seat situation measure father believe subject.
R10123,C1561,Mobile,2,2023-10-18,Live tax score son college letter in simple same conference whole.
R10124,C1820,Shoes,3,2023-07-30,Despite run day hold leg personal second miss that story.
R10125,C1539,Earphones,5,2025-08-29,Bring watch hear part every drop lay.
R10126,C1651,Mobile,4,2023-11-22,Member really cut fear TV condition who.
R10127,C1498,Washing Machine,4,2024-09-23,Still specific evidence quality to leave chair wish even also.
R10128,C1690,Earphones,5,2023-06-28,Least stand bag listen require among computer chance right share five physical.
R10129,C1864,Washing Machine,1,2025-01-13,Law investment certainly day only big director just image.
R10130,C1187,Mouse,3,2023-11-16,Today some let day high collection oil more live experience.
R10131,C1422,Clothes,4,2024-10-16,Per for back white staff laugh cover out then everything financial individual.
R10132,C1021,Clothes,3,2024-10-30,Heart huge behavior thank garden school pretty paper.
R10133,C1295,Laptop,5,2024-09-11,Language season however civil send miss include.
R10134,C1726,TV,1,2025-10-02,Suggest send allow most student kid history writer course street have produce.
R10135,C1783,Keyboard,3,2023-11-24,Relate pretty study term stand certain cup billion travel friend everybody not.
R10136,C1579,TV,5,2023-07-06,Whole coach information down take community.
R10137,C1533,Mouse,3,2023-01-19,Into concern guy early because pretty style once maintain.
R10138,C1403,Shoes,3,2023-11-10,Production season decision get wish lead.
R10139,C1391,Laptop,4,2024-09-14,Standard always smile game drive hour need alone keep.
R10140,C1001,Keyboard,4,2025-11-17,Avoid free serious lead modern life hope.
R10141,C1065,Charger,2,2024-07-27,Finish tonight commercial only and position look though help speech sometimes.
R10142,C1946,Mobile,1,2024-10-24,Tend article author again painting maintain your industry.
R10143,C1070,Washing Machine,1,2024-02-04,Read new outside after may rich music professional single.
R10144,C1737,TV,3,2024-06-11,Fast magazine throughout effect too go party stock understand floor entire mind.
R10145,C1021,Laptop,4,2023-02-08,Trouble activity success join far pay check themselves before fire nor yourself.
R10146,C1258,Mouse,4,2023-07-05,Before something decide item get take resource should specific news partner into lead.
R10147,C1148,Laptop,5,2023-11-24,Ok memory general he as pick my generation design fight.
R10148,C1854,Shoes,5,2025-07-06,Behind often star however program night financial method understand happen space current.
R10149,C1794,TV,4,2023-03-25,Sense theory painting off single manage why collection.
R10150,C1897,Shoes,3,2024-08-31,Little year few news final remember.
R10151,C1189,Shoes,5,2023-10-25,Always finally one perhaps arm far name enter green set maybe successful remain.
R10152,C1475,Mobile,2,2024-11-21,You base protect our wear commercial record paper issue likely.
R10153,C1868,AC,4,2023-06-15,Ability loss culture so eat white establish same or society.
R10154,C1459,Earphones,2,2023-03-03,Ball particular number cost state table change send food.
R10155,C1189,Charger,2,2025-10-02,Push spring so get a leader may maintain loss fact four hold.
R10156,C1403,Shoes,3,2025-08-13,Owner size forget analysis feeling job take white.
R10157,C1725,Washing Machine,5,2025-04-02,Woman executive mouth pattern nation rock entire bring responsibility believe evening exactly.
R10158,C1767,Earphones,2,2023-11-30,Central law show game avoid myself international here guy control network evidence.
R10159,C1280,Shoes,5,2025-01-29,Agency treatment order add treatment people field serious left popular kind music fund.
R10160,C1720,Charger,5,2023-01-21,Service key range community senior water outside success yourself.
R10161,C1774,Laptop,2,2024-11-24,Pull set relate anything its investment.
R10162,C1662,Clothes,2,2023-09-08,Thank student same impact suffer difficult indeed general help.
R10163,C1440,Laptop,3,2025-08-02,Big rate summer plan network executive today.
R10164,C1626,Earphones,3,2023-04-10,Away somebody newspaper speak increase concern.
R10165,C1144,Mouse,4,2024-08-13,Letter name remain business child every hot factor near artist good mission lay.
R10166,C1806,Earphones,3,2023-11-06,Police century growth five spring fill floor rate college including science even newspaper amount.
R10167,C1786,Mobile,3,2024-07-12,Number single field pattern artist three station sit chair.
R10168,C1306,Earphones,5,2023-01-01,Girl fact everyone reflect degree lay idea level plan tonight.
R10169,C1577,Mobile,4,2024-01-22,Place involve firm table American occur property song scene level production material option.
R10170,C1625,Laptop,1,2023-06-11,Wall happen company fact me decade small view return.
R10171,C1297,Charger,4,2023-08-13,Appear onto sit forward side already yet start.
R10172,C1191,Mobile,2,2024-07-18,Professor four modern water drive north account recently consumer record such natural.
R10173,C1376,Laptop,5,2025-06-23,Enter way push prove she yes.
R10174,C1164,AC,3,2023-05-09,Purpose second week north action western trade rather parent expert shoulder behavior treatment.
R10175,C1794,Charger,2,2024-03-31,Carry when put car animal sound information.
R10176,C1376,Charger,1,2023-10-27,Man front second market hit study its offer resource likely her black development.
R10177,C1256,Clothes,4,2025-07-20,Often decade hot than all up girl current.
R10178,C1459,Mobile,2,2023-09-16,Recognize able media especially difficult month.
R10179,C1424,Earphones,2,2023-04-15,Should peace yeah past administration hour own hospital long position dinner your.
R10180,C1507,AC,5,2025-05-03,Point a day ground notice relationship.
R10181,C1974,Mouse,4,2024-09-06,Attorney either either summer short me.
R10182,C1027,Mouse,3,2024-07-02,Teach analysis agent call then keep want operation.
R10183,C1171,Washing Machine,5,2022-12-28,Behavior order strong southern along think pick could unit job.
R10184,C1742,Shoes,4,2024-09-10,Fight his front whatever time animal.
R10185,C1993,Charger,5,2023-11-09,Mrs bar many itself dark sport interesting present.
R10186,C1368,AC,1,2024-08-25,Popular entire area adult wait mind three international maintain two each development under.
R10187,C1013,AC,4,2023-08-30,If kind myself young develop development player TV car everybody red land.
R10188,C1017,Clothes,3,2024-09-28,Most evening result like system describe mind strategy data big kind cut employee.
R10189,C1785,Clothes,1,2024-03-01,Travel air themselves structure involve woman.
R10190,C1652,TV,3,2023-12-11,Base a away certainly chair but quite baby.
R10191,C1466,Keyboard,3,2025-08-05,Particularly nearly half drop then today pull write final strong page send.
R10192,C1219,Clothes,4,2025-08-10,Use civil media man religious hand.
R10193,C1985,Shoes,2,2024-08-08,Security moment low team every success herself.
R10194,C1007,Keyboard,4,2023-08-29,Important past leave call subject budget moment ever.
R10195,C1149,Clothes,1,2024-09-15,Them boy this describe she enter enter movement.
R10196,C1203,Laptop,2,2022-12-27,Article clearly both west everyone letter.
R10197,C1431,Keyboard,4,2023-06-13,If town western poor current production type design close thus.
R10198,C1209,Keyboard,4,2025-10-04,Respond house green along hair property white research drug gas edge college.
R10199,C1495,Charger,5,2025-04-17,Professional break group story yes together concern.
R10200,C1596,Washing Machine,2,2023-10-15,Team spend less so mouth specific rich above.
R10201,C1306,AC,5,2023-08-02,Hot save mouth another indicate situation.
R10202,C1520,Washing Machine,5,2023-11-04,Cell order a often parent collection arrive pattern mind foreign.
R10203,C1387,Mobile,3,2025-12-02,Matter option politics great prove machine citizen hold language talk interview science child.
R10204,C1973,Keyboard,1,2024-11-29,On quite good top financial town physical here.
R10205,C1792,AC,5,2025-08-24,None agency certain full yes discover benefit behavior already close condition billion.
R10206,C1717,TV,5,2024-08-23,Message glass agent law past if budget nature other.
R10207,C1682,Washing Machine,5,2024-08-10,Keep fall you beat environmental money mean you leave customer.
R10208,C1272,Earphones,3,2024-07-24,Chance sea road will next never only land realize around.
R10209,C1104,Mobile,1,2023-12-24,Statement understand office exist put who with paper born across ground adult charge.
R10210,C1651,Clothes,4,2023-07-02,Increase official make citizen task take risk have card citizen interest herself.
R10211,C1005,TV,1,2022-12-04,Discover close administration necessary value create.
